{
  "schemaVersion": 1,
  "generatedAt": "2026-10-15T16:41:47.312Z",
  "totalCount": 8,
  "entries": [
    {
      "id": "spassglas.biom-kompass",
      "name": "Biom-Kompass",
      "author": "Spassglas Studio",
      "category": "addon",
      "license": "CC-BY-4.0",
      "keywords": [
        "addon",
        "biom",
        "hud",
        "kompass",
        "skript",
        "spassglas",
        "studio"
      ],
      "tags": [
        "addon",
        "skript",
        "hud"
      ]
    },
    {
      "id": "spassglas.holzbretter-textur",
      "name": "Holzbretter",
      "author": "Spassglas Studio",
      "category": "texturen",
      "license": "CC-BY-4.0",
      "keywords": [
        "bretter",
        "holz",
        "holzbretter",
        "spassglas",
        "studio",
        "textur"
      ],
      "tags": [
        "holz",
        "bretter"
      ]
    },
    {
      "id": "spassglas.knapp-deutsch",
      "name": "Knapp-Deutsch",
      "author": "Spassglas Studio",
      "category": "sprache",
      "license": "CC-BY-4.0",
      "keywords": [
        "deutsch",
        "knapp",
        "menue",
        "spassglas",
        "sprache",
        "studio"
      ],
      "tags": [
        "sprache",
        "deutsch",
        "menue"
      ]
    },
    {
      "id": "spassglas.kompakt-hud",
      "name": "Kompakt-HUD",
      "author": "Spassglas Studio",
      "category": "hud",
      "license": "CC-BY-4.0",
      "keywords": [
        "hud",
        "kompakt",
        "koordinaten",
        "spassglas",
        "studio"
      ],
      "tags": [
        "hud",
        "koordinaten",
        "kompakt"
      ]
    },
    {
      "id": "spassglas.mehr-rezepte",
      "name": "Mehr Rezepte",
      "author": "Spassglas Studio",
      "category": "addon",
      "license": "CC-BY-4.0",
      "keywords": [
        "addon",
        "crafting",
        "mehr",
        "rezepte",
        "spassglas",
        "studio"
      ],
      "tags": [
        "addon",
        "rezepte",
        "crafting"
      ]
    },
    {
      "id": "spassglas.mitternacht-theme",
      "name": "Mitternacht",
      "author": "Spassglas Studio",
      "category": "theme",
      "license": "CC-BY-4.0",
      "keywords": [
        "dunkel",
        "kontrast",
        "mitternacht",
        "spassglas",
        "studio",
        "theme"
      ],
      "tags": [
        "dunkel",
        "kontrast"
      ]
    },
    {
      "id": "spassglas.steinbrocken-textur",
      "name": "Steinbrocken",
      "author": "Spassglas Studio",
      "category": "texturen",
      "license": "CC-BY-4.0",
      "keywords": [
        "gestein",
        "spassglas",
        "stein",
        "steinbrocken",
        "studio",
        "textur"
      ],
      "tags": [
        "stein",
        "gestein"
      ]
    },
    {
      "id": "spassglas.tageslicht-theme",
      "name": "Tageslicht",
      "author": "Spassglas Studio",
      "category": "theme",
      "license": "CC-BY-4.0",
      "keywords": [
        "hell",
        "spassglas",
        "studio",
        "tageslicht",
        "theme",
        "warm"
      ],
      "tags": [
        "theme",
        "hell",
        "warm"
      ]
    }
  ]
}
